{
  "$schema": "https://json-schema.org/draft/2020-12/schema",
  "title": "3x02 Alert Queue",
  "description": "Alert queue contract produced by 15-generate_alerts.sh",
  "type": "array",
  "items": {
    "type": "object",
    "required": [
      "alert_id",
      "generated_at",
      "rule_id",
      "rule_title",
      "rule_level",
      "priority_score",
      "event_ref",
      "event_summary",
      "asset_context",
      "attack_techniques",
      "status",
      "evidence_hash"
    ],
    "properties": {
      "alert_id": {
        "type": "string",
        "format": "uuid"
      },
      "generated_at": {
        "type": "string",
        "format": "date-time"
      },
      "rule_id": {
        "type": "string"
      },
      "rule_title": {
        "type": "string"
      },
      "rule_level": {
        "type": "string"
      },
      "priority_score": {
        "type": "number",
        "minimum": 0
      },
      "event_ref": {
        "type": "string"
      },
      "event_summary": {
        "type": "object",
        "required": [
          "timestamp",
          "hostname",
          "user",
          "src_ip",
          "dst_ip",
          "process_name",
          "canonical_label",
          "event_category"
        ]
      },
      "asset_context": {
        "type": "object"
      },
      "attack_techniques": {
        "type": "array",
        "items": {
          "type": "string",
          "pattern": "^T\\d{4}(\\.\\d{3})?$"
        }
      },
      "status": {
        "type": "string",
        "enum": [
          "new"
        ]
      },
      "evidence_hash": {
        "type": "string",
        "pattern": "^[a-f0-9]{64}$"
      }
    },
    "additionalProperties": false
  }
}
